[
  {
    "id": "w1_projectile",
    "name": "Projectile",
    "type": "projectile",
    "targeting": "nearest",
    "unlockLevel": 1,
    "orbDamageCooldown": 0,
    "statsPerLevel": [
      {
        "level": 1,
        "damage": 8,
        "cooldown": 1.0,
        "projectileCount": 1
      },
      {
        "level": 2,
        "damage": 10,
        "cooldown": 0.95,
        "projectileCount": 1
      },
      {
        "level": 3,
        "damage": 12,
        "cooldown": 0.9,
        "projectileCount": 1
      },
      {
        "level": 4,
        "damage": 15,
        "cooldown": 0.85,
        "projectileCount": 1
      },
      {
        "level": 5,
        "damage": 18,
        "cooldown": 0.8,
        "projectileCount": 2
      },
      {
        "level": 6,
        "damage": 22,
        "cooldown": 0.75,
        "projectileCount": 2
      },
      {
        "level": 7,
        "damage": 28,
        "cooldown": 0.65,
        "projectileCount": 3
      }
    ],
    "powerSpikes": {
      "level4": {
        "name": "Pierce",
        "description": "Pierces +1 enemy",
        "statModifiers": {
          "pierceCount": 1
        }
      },
      "level7": {
        "name": "Split",
        "description": "Splits into 3",
        "statModifiers": {
          "splitCount": 3
        }
      }
    },
    "visual": {
      "shape": "square",
      "color": "#FFD700"
    }
  },
  {
    "id": "w2_orbit",
    "name": "Orbit",
    "type": "orbit",
    "targeting": "self",
    "unlockLevel": 3,
    "orbDamageCooldown": 0.5,
    "statsPerLevel": [
      {
        "level": 1,
        "damage": 5,
        "cooldown": 2.0,
        "orbitCount": 2,
        "orbitSpeed": 2.0,
        "orbitRadius": 80
      },
      {
        "level": 2,
        "damage": 6,
        "cooldown": 1.85,
        "orbitCount": 2,
        "orbitSpeed": 1.85,
        "orbitRadius": 85
      },
      {
        "level": 3,
        "damage": 7,
        "cooldown": 1.7,
        "orbitCount": 2,
        "orbitSpeed": 1.7,
        "orbitRadius": 90
      },
      {
        "level": 4,
        "damage": 9,
        "cooldown": 1.55,
        "orbitCount": 3,
        "orbitSpeed": 1.55,
        "orbitRadius": 120
      },
      {
        "level": 5,
        "damage": 11,
        "cooldown": 1.4,
        "orbitCount": 3,
        "orbitSpeed": 1.4,
        "orbitRadius": 130
      },
      {
        "level": 6,
        "damage": 13,
        "cooldown": 1.3,
        "orbitCount": 4,
        "orbitSpeed": 1.3,
        "orbitRadius": 140
      },
      {
        "level": 7,
        "damage": 16,
        "cooldown": 1.0,
        "orbitCount": 4,
        "orbitSpeed": 1.0,
        "orbitRadius": 160
      }
    ],
    "powerSpikes": {
      "level4": {
        "name": "Expanded Orbit",
        "description": "+50% radius, +1 orb",
        "statModifiers": {
          "orbitRadiusBonus": 0.5
        }
      },
      "level7": {
        "name": "Afterimage",
        "description": "Damaging trails",
        "statModifiers": {
          "afterimageDuration": 0.5
        }
      }
    },
    "visual": {
      "shape": "circle",
      "color": "#4FC3F7"
    }
  },
  {
    "id": "weapon_area_pulse",
    "name": "Area",
    "type": "area",
    "targeting": "player_position",
    "unlockLevel": 6,
    "orbDamageCooldown": 0,
    "statsPerLevel": [
      {
        "level": 1,
        "damage": 12,
        "cooldown": 2.5,
        "pulseRadius": 80,
        "pulseCount": 1
      },
      {
        "level": 2,
        "damage": 15,
        "cooldown": 2.35,
        "pulseRadius": 88,
        "pulseCount": 1
      },
      {
        "level": 3,
        "damage": 18,
        "cooldown": 2.2,
        "pulseRadius": 96,
        "pulseCount": 1
      },
      {
        "level": 4,
        "damage": 22,
        "cooldown": 2.0,
        "pulseRadius": 110,
        "pulseCount": 2
      },
      {
        "level": 5,
        "damage": 27,
        "cooldown": 1.85,
        "pulseRadius": 120,
        "pulseCount": 2
      },
      {
        "level": 6,
        "damage": 33,
        "cooldown": 1.7,
        "pulseRadius": 135,
        "pulseCount": 2
      },
      {
        "level": 7,
        "damage": 42,
        "cooldown": 1.4,
        "pulseRadius": 160,
        "pulseCount": 3
      }
    ],
    "powerSpikes": {
      "level4": {
        "name": "Double Pulse",
        "description": "Fires twice",
        "statModifiers": {
          "pulseCountBonus": 1
        }
      },
      "level7": {
        "name": "Devastation",
        "description": "Triple + stun",
        "statModifiers": {
          "thirdPulseStunDuration": 1.0
        }
      }
    },
    "visual": {
      "shape": "circle",
      "color": "#FF9100"
    }
  }
]